{
  "branch": "normalization/event-media-blocker-closure-v1",
  "closure_id": "event-media-blocker-closure-v1",
  "constraints": {
    "candidate_contract_accepted": false,
    "experiment_winner_selected": false,
    "final_media_tokens_created": false,
    "implementation_started": false,
    "legacy_deleted": false,
    "merge_or_deploy_authorized": false,
    "migration_started": false,
    "normalization_allowed": false,
    "owner_decision_accepted": false,
    "page_archetypes_created": false,
    "penpot_changed": false,
    "physical_component_operation": false,
    "production_ui_changed": false,
    "promotion_ready": false
  },
  "delivery": {
    "pull_request": {
      "draft": true,
      "merge_authorized": false,
      "merge_requested": false,
      "merged": false,
      "number": 33,
      "state": "open",
      "url": "https://github.com/onedayonemasterpiece/lovekgd-design-system/pull/33"
    }
  },
  "derived_state": {
    "behavioral_bindings": 9,
    "decision_cards": 3,
    "exact_missing_facts": {
      "EM-CROP-004": [
        "Direct renderer enforcement that gates cover with crop permission, focal point and safe-area/protected-region data for every covered affected consumer, or an accepted consumer-specific non-applicability record.",
        "Executable consumer tests or reviewed exact runtime showing the safe/focal rule, not only metadata presence or standalone resolveEventImageCrop unit tests."
      ],
      "EM-FALLBACK-006": [
        "Exact load-error tests or reviewed runtime proving that broken Event Detail primary, poster companion, desktop/mobile fullscreen and preview images converge to the intended semantic fallback while preserving geometry.",
        "Consumer-specific convergence behavior that hides the failed image/browser marker and distinguishes broken-source recovery from the already evidenced missing-source fallback."
      ],
      "EM-LAYOUT-007": [
        "A positive per-slot applicability matrix for desktop fullscreen, desktop preview/viewer slots, mobile primary and mobile fullscreen that proves deterministic reservation and either a genuine visible loading/recovery state or explicit SSG non-applicability.",
        "Exact runtime evidence for the lazy gallery load/error path; width/height and loading=lazy alone do not establish a user-visible loading or recovery contract."
      ],
      "EM-PROVENANCE-012": [
        "For every eventually accepted consumer cell, resolvable source and requirement authority plus exact runtime evidence, or an explicit reasoned runtime non-applicability bound to that same cell.",
        "Resolution of the PR #32 matrix policy statuses: all 52 fit/crop/focal/safe/object-position/tiny/fallback/loading/responsive fields remain source_observed_requirement_reconciliation_pending and all 52 runtime cells deny production equivalence/observation."
      ],
      "EM-RATIO-002": [
        "A positively accepted consumer-and-slot ratio applicability matrix for the exact affected consumers, including 4:5, 5:4, 3:2, 2:3, 1:1, intrinsic/source and explicit non-applicability where warranted.",
        "Direct evidence that each ratio is a consumer-local source/frame rule rather than a global Event Media ratio token; all PR #32 cells remain candidate_not_accepted and target_ratio_selected=false."
      ],
      "EM-RESP-008": [
        "A terminal PASS or accepted, reasoned non-applicability for each of the nine exact DesktopEventPage cascade probe IDs; every pinned probe remains MISMATCH.",
        "A consumer-level responsive art-direction decision for primary media, with alternate-source behavior or explicit accepted non-applicability; the pinned route only switches desktop/mobile DOM and does not supply alternate media sources."
      ],
      "EM-RUNTIME-009": [
        "Reviewed production-equivalent or production-observed evidence bound to the exact Event Detail desktop/mobile primary, companion, preview and fullscreen consumers and their missing, broken and tiny states.",
        "An exact desktop and mobile fullscreen Event Detail packet; all five existing media packets and all 52 census runtime cells explicitly have production_equivalent=false and production_observed=false."
      ],
      "EM-SEMANTIC-003": [
        "An executable and tested mapping for photography, poster/artwork, OCR/document, unknown-text and classified non-photo documents across DesktopEventPage, EventHero, EventMediaRail and the affected mobile-listing rails.",
        "Direct reconciliation of media_role versus image_text_mode for classified non-photo visual_only assets; current large renderers primarily branch on image_text_mode and EventMediaRail exposes no semantic policy."
      ],
      "EM-TINY-005": [
        "A tested maximum rendered-to-source upscale ceiling for each affected primary, companion, preview, fullscreen and lab-rail consumer without creating a global ratio token.",
        "An executable EventHero test and reachable predicate for the intended low-resolution containment branch; the pinned caller predicate remains logically contradictory."
      ]
    },
    "experiments_not_merged": 6,
    "fixtures": 13,
    "full_resolution_reviews": 4,
    "incomplete_blocker_ids": [
      "EM-RATIO-002",
      "EM-SEMANTIC-003",
      "EM-CROP-004",
      "EM-TINY-005",
      "EM-FALLBACK-006",
      "EM-LAYOUT-007",
      "EM-RESP-008",
      "EM-RUNTIME-009",
      "EM-PROVENANCE-012"
    ],
    "incomplete_evidence_blockers": 9,
    "not_ready_candidates": 3,
    "options": 9,
    "owner_blockers": 3,
    "pngs": 4,
    "product_value": {
      "authoritative_product_ids": 0,
      "mode": "observe",
      "promotion_ready": false,
      "value_evidence_status": "pending_product_model"
    },
    "readiness_blocked": 33,
    "readiness_checks": 69,
    "readiness_not_applicable": 3,
    "readiness_pass": 33,
    "readiness_rows": 3,
    "ready_candidates": 0,
    "resolved_or_invalidated_blockers": 0,
    "vendored_assets": 9
  },
  "frozen_pr32": {
    "boundary_records": 31,
    "candidate_contracts": 3,
    "consumer_applications": 52,
    "files": {
      "catalog/normalization/event-media/alternatives-and-recommendations.jsonl": {
        "bytes": 93283,
        "records": 31,
        "sha256": "7848ae9dae25763020dcb065879763897e5b31ed74a2343b81e411c6ebe33d0d"
      },
      "catalog/normalization/event-media/blocker-closure.jsonl": {
        "bytes": 34799,
        "records": 12,
        "sha256": "22337fc3911fcbfb73be7cfc3045808245d430030a65990dc7209ce83878024f"
      },
      "catalog/normalization/event-media/boundary-model.jsonl": {
        "bytes": 240201,
        "records": 31,
        "sha256": "420f2547bc95eddfb6f5374d25c508cb43a3a135f34bd78c0d84bb93a4b6ffec"
      },
      "catalog/normalization/event-media/candidate-contracts/candidate.event-fallback-art.json": {
        "bytes": 18122,
        "records": null,
        "sha256": "41a0812f606522c7ee5985ca63dd654645d03bb78ab4b2355281eb6255177b61"
      },
      "catalog/normalization/event-media/candidate-contracts/candidate.event-media-viewer.json": {
        "bytes": 27084,
        "records": null,
        "sha256": "f1983b68fecdf715cd176a3ef5b4229936aad71bec420f91582beec4bed6375a"
      },
      "catalog/normalization/event-media/candidate-contracts/candidate.event-primary-media.json": {
        "bytes": 25780,
        "records": null,
        "sha256": "a5e7186be9051ac8861b2223576480215add941520141052941ed2542aaba76d"
      },
      "catalog/normalization/event-media/consumer-requirement-matrix.jsonl": {
        "bytes": 619782,
        "records": 52,
        "sha256": "b3f041ad3e64cce6c4690c84a12515fbdef6f8ce649ab85fecc9d03c3d89c009"
      },
      "catalog/normalization/event-media/owner-decision-queue.jsonl": {
        "bytes": 6186,
        "records": 2,
        "sha256": "19ca340ef0e8e42717fb1a849875aa8082fe5ccff0ccab15812c3b9db708de39"
      },
      "catalog/normalization/event-media/readiness.jsonl": {
        "bytes": 63174,
        "records": 3,
        "sha256": "87bf003c9f9ffc80afcfd361f5a257e1ff56a227d5a41138665c4e6e886a5204"
      },
      "catalog/normalization/event-media/semantic-media-types.jsonl": {
        "bytes": 76182,
        "records": 23,
        "sha256": "8989734d1057fb3785dbd05403d7803c052de804eb798e3faeb21b56208e81ee"
      },
      "receipts/normalization/event-media-contract-decision-v1.json": {
        "bytes": 12531,
        "records": null,
        "sha256": "d84f55217fbd0745334f81a737acaedc171231a053ae57f28278cf41db67df8e"
      }
    },
    "owner_required_blockers": 3,
    "readiness_checks_per_candidate": 23,
    "readiness_rows": 3,
    "semantic_records": 23,
    "source_blockers": 12,
    "source_still_open_blockers": 9
  },
  "lineage": {
    "audited_pr32_head": "20eab45534e2c64497e4db661e6a5ca8582229ea",
    "materialization_parent_commit": "8a77c50df1cd518e516da3d3cccf1794c4aba84a",
    "merge_parent_1": "45288b001d724e0d3603d0c44d392ff370407bd0",
    "merge_parent_2": "20eab45534e2c64497e4db661e6a5ca8582229ea",
    "merged_main": "3cbe35326ead04ac67070e5b400d30d9edc6eb01"
  },
  "output_bytes": 6139586,
  "output_count": 51,
  "outputs": {
    ".codex/integration/event-media-blocker-closure-v1/EXECUTION_MATRIX.md": {
      "bytes": 3670,
      "records": null,
      "sha256": "28c5fd1589bd5dd244a5449553b9102a21f5e66d5382fd392376b5675b018814"
    },
    ".codex/integration/event-media-blocker-closure-v1/INTEGRATION_REPORT.md": {
      "bytes": 4047,
      "records": null,
      "sha256": "e8ecc18cfd9d340d0dd383794efbcc95596ad67eebfe89766415d0f42ef42065"
    },
    ".codex/integration/event-media-blocker-closure-v1/LANE_MAP.yml": {
      "bytes": 6573,
      "records": null,
      "sha256": "d7fdd8e8bac4d6ba6692a17a07e868e00a2922e07cb61d7abcfb29b067f946fe"
    },
    ".codex/lanes/event-media-blocker-evidence/RESULTS.md": {
      "bytes": 8446,
      "records": null,